audience,datasets,consideration,description,documentation-url,end-date,entry-date,github-discussion,long-name,long-plural,name,json,prefix,specification,specification-reason,specification-status,start-date
,design-code;design-code-rule;design-code-area,,,,,2022-06-09,27,,,Design code,"[{""dataset"": ""design-code"", ""fields"": [{""description"": ""the <a href=\""#reference\"">reference</a> for the design code"", ""field"": ""reference""}, {""description"": ""the name, or title of the design code"", ""field"": ""name""}, {""description"": ""a short, single-line description of the design code"", ""field"": ""description""}, {""dataset"": ""design-code-status"", ""description"": ""a <a href=\""#design-code-status\"">design-code-status</a> reference"", ""field"": ""design-code-status""}, {""description"": ""the URL for the Web page with guidance on the design code policy document"", ""field"": ""documentation-url""}, {""description"": ""the URL for the Design Code. This should be a URL to a website or document"", ""field"": ""document-url""}, {""description"": ""optional notes on the status of the design code"", ""field"": ""notes""}, {""description"": ""the <a href=\""#date\"">date</a> the design code comes, or came into force"", ""field"": ""start-date""}, {""description"": ""the <a href=\""#date\"">date</a> this date the design code no longer applies"", ""field"": ""end-date""}, {""description"": ""the <a href=\""#date\"">date</a> this entry was created or last amended"", ""field"": ""entry-date""}], ""name"": ""design code""}, {""dataset"": ""design-code-rule"", ""fields"": [{""description"": ""the <a href=\""#reference\"">reference</a> for the design code rule"", ""field"": ""reference""}, {""description"": ""the name, or title of the design code rule"", ""field"": ""name""}, {""description"": ""the <a href=\""#reference\"">reference</a> for the design code where this rule is defined."", ""field"": ""design-code""}, {""description"": ""a short, single-line description of the design code rule"", ""field"": ""description""}, {""description"": ""the URL for the design code rule. This should be a URL to a website or document"", ""field"": ""document-url""}, {""description"": ""the URL for a page where we can find a link to the design code rule, this is usually a contents or summary page"", ""field"": ""documentation-url""}, {""dataset"": ""design-code-rule-category"", ""description"": ""a list of one or more <a href=\""#design-code-category\"">design-code-rule-categories</a> references, separated by a semi-colon ';' character"", ""example"": ""public-art;building-height"", ""field"": ""design-code-rule-categories""}, {""description"": ""a field to capture notes about the design code rule"", ""field"": ""notes""}, {""description"": ""the date this information has been entered as a record"", ""field"": ""entry-date""}, {""description"": ""the date the validity of the record starts"", ""field"": ""start-date""}, {""description"": ""the date the validity of the record ends"", ""field"": ""end-date""}], ""name"": ""design code rule""}, {""dataset"": ""design-code-area"", ""fields"": [{""description"": ""the <a href=\""#reference\"">reference</a> for the design code area"", ""field"": ""reference""}, {""description"": ""the name, or title of the design code area"", ""field"": ""name""}, {""description"": ""the boundaries of the design code area as a POLYGON or MULTIPOLYGON, with points in the EPSG 4326 coordinate reference system, and WGS85 datum, encoded in Well-Known Text (WKT) representation of geometry."", ""field"": ""geometry""}, {""description"": ""the <a href=\""#reference\"">reference</a> for the design code which applies to this area"", ""field"": ""design-code""}, {""description"": ""a list of one or more <a href=\""#reference\"">reference</a> values for <a href=\""design-code-rule-dataset\"">design code rule</a> entries, separated by a semi-colon ';' character."", ""field"": ""design-code-rules""}, {""dataset"": ""design-code-area-type"", ""description"": ""the classification of the area, for example Rural Settlements or Urban Neighbourhood"", ""field"": ""design-code-area-type""}, {""description"": ""the URL for guidance or information defining the design code area"", ""field"": ""documentation-url""}, {""description"": ""a field to capture notes about the design code area"", ""field"": ""notes""}, {""description"": ""the date this information has been entered as a record"", ""field"": ""entry-date""}, {""description"": ""the date the validity of the record starts"", ""field"": ""start-date""}, {""description"": ""the date the validity of the record ends"", ""field"": ""end-date""}], ""name"": ""design code area""}]",,design-code,prospective,working-draft,
,developer-agreement;developer-agreement-contribution;developer-agreement-transaction,,,,,2022-06-09,34,,,Developer contributions,"[{""dataset"": ""developer-agreement"", ""description"": ""A developer agreement is any legal document that secures contributions from a development for infrastructure or affordable housing (including section 106 planning obligations and section 278 agreements), or any demand notice for CIL."", ""fields"": [{""field"": ""reference""}, {""field"": ""name""}, {""field"": ""developer-agreement-type""}, {""field"": ""planning-application""}, {""field"": ""document-url""}, {""field"": ""notes""}, {""field"": ""organisation""}, {""field"": ""entry-date""}, {""field"": ""start-date""}, {""field"": ""end-date""}]}, {""dataset"": ""developer-agreement-contribution"", ""description"": ""Developer agreement contributions are the individual obligations or sums within an agreement, assigned to particular purposes such as affordable housing."", ""fields"": [{""field"": ""reference""}, {""field"": ""developer-agreement""}, {""field"": ""contribution-purpose""}, {""field"": ""amount""}, {""field"": ""units""}, {""field"": ""notes""}, {""field"": ""organisation""}, {""field"": ""entry-date""}, {""field"": ""start-date""}, {""field"": ""end-date""}]}, {""dataset"": ""developer-agreement-transaction"", ""fields"": [{""field"": ""reference""}, {""field"": ""developer-agreement-contribution""}, {""field"": ""contribution-funding-status""}, {""field"": ""amount""}, {""field"": ""units""}, {""field"": ""notes""}, {""field"": ""organisation""}, {""field"": ""entry-date""}, {""field"": ""start-date""}, {""field"": ""end-date""}]}]",,developer-contributions,cil-2019,open-standard,
,development-corporation-boundary,development-corporation,,,,2025-11-25,,,,development corporation boundary,"[{""dataset"": ""development-corporation-boundary"", ""fields"": [{""field"": ""reference"", ""requirement-level"": ""MUST""}, {""field"": ""name"", ""requirement-level"": ""SHOULD""}, {""field"": ""documentation-url"", ""requirement-level"": ""SHOULD""}, {""field"": ""document-url"", ""requirement-level"": ""SHOULD""}, {""field"": ""geometry"", ""requirement-level"": ""SHOULD""}, {""field"": ""entry-date"", ""requirement-level"": ""SHOULD""}, {""field"": ""start-date"", ""requirement-level"": ""SHOULD""}, {""field"": ""end-date"", ""requirement-level"": ""MAY""}, {""field"": ""notes"", ""requirement-level"": ""MAY""}], ""priority"": 1, ""requirement-level"": ""SHOULD""}]",,development-corporation-boundary,prospective,working-draft,
,development-policy;development-policy-area,,,,,2023-04-05,,,,Development policy,"[{""dataset"": ""development-policy"", ""fields"": [{""field"": ""reference""}, {""field"": ""name""}, {""field"": ""development-plan-document""}, {""field"": ""development-policy-categories""}, {""field"": ""organisation""}, {""field"": ""entry-date""}, {""field"": ""start-date""}, {""field"": ""end-date""}], ""name"": ""development policy""}, {""dataset"": ""development-policy-area"", ""fields"": [{""field"": ""reference""}, {""field"": ""name""}, {""dataset"": ""development-policy"", ""field"": ""development-policies""}, {""field"": ""geometry""}, {""field"": ""organisation""}, {""field"": ""entry-date""}, {""field"": ""start-date""}, {""field"": ""end-date""}], ""name"": ""development policy area""}]",,development-policy,prospective,working-draft,
,infrastructure-funding-statement,infrastructure-funding-statements,,,,2023-11-23,,,,Infrastructure funding statement,"[{""dataset"": ""infrastructure-funding-statement"", ""fields"": [{""description"": ""a unique identifier for the IFS document"", ""field"": ""reference""}, {""description"": ""the name given to the IFS document"", ""field"": ""name""}, {""description"": ""a url to the IFS document"", ""field"": ""document-url""}, {""description"": ""a url to the page where the IFS document has been published"", ""field"": ""documentation-url""}, {""description"": ""a reference to the publishing organisation"", ""field"": ""organisation""}, {""description"": ""a date for the start of the period the document covers"", ""field"": ""period-start-date""}, {""description"": ""a date for the end of the period the document covers"", ""field"": ""period-end-date""}, {""description"": ""any additional notes"", ""field"": ""notes""}, {""description"": ""the date this record was created"", ""field"": ""entry-date""}, {""description"": ""the date this record is valid from, for example the date the document was published to the urls provided"", ""field"": ""start-date""}, {""description"": ""the date this record is not longer true, for example if the urls to the document change"", ""field"": ""end-date""}]}]",,infrastructure-funding-statement,prospective,piloting,
,infrastructure-project;infrastructure-project-log;infrastructure-project-document,nationally-significant-infrastructure-projects,,,,2023-09-14,,,,infrastructure project,"[{""dataset"": ""infrastructure-project"", ""fields"": [{""description"": ""the NSIP id"", ""field"": ""reference""}, {""description"": ""the name of the project"", ""field"": ""name""}, {""description"": ""a brief description of the project"", ""field"": ""description""}, {""description"": ""the organisation id of the organisation making the application"", ""field"": ""applicant-organisation""}, {""dataset"": ""infrastructure-project-decision"", ""description"": ""the decision, once it has been made. For example `consent-granted`"", ""field"": ""infrastructure-project-decision""}, {""description"": ""the date the decision was made, for example `2023-09-14`"", ""field"": ""decision-date""}, {""description"": ""which secretary of state made the decision"", ""field"": ""decision-maker""}, {""description"": ""the site boundary for the proposed development"", ""field"": ""geometry""}, {""field"": ""point""}, {""description"": ""a url to a page with more information about the project"", ""field"": ""documentation-url""}, {""dataset"": ""infrastructure-project-type"", ""description"": ""the type of project, for example generating-stations"", ""field"": ""infrastructure-project-type""}, {""description"": ""any additional notes in this field"", ""field"": ""notes""}, {""description"": ""the organisation id of the organisation that provided this data"", ""field"": ""organisation""}, {""field"": ""entry-date""}, {""field"": ""start-date""}, {""field"": ""end-date""}], ""name"": ""Infrastructure project""}, {""dataset"": ""infrastructure-project-log"", ""fields"": [{""field"": ""reference""}, {""description"": ""the ID of the infrastructure project"", ""field"": ""infrastructure-project""}, {""dataset"": ""infrastructure-project-event"", ""description"": ""an event reference for something that has happened during the process"", ""field"": ""infrastructure-project-event""}, {""description"": ""the date the event happened, for example `2023-09-14`"", ""field"": ""event-date""}, {""description"": ""any additional notes in this field"", ""field"": ""notes""}, {""description"": ""the organisation id of the organisation that provided this data"", ""field"": ""organisation""}, {""field"": ""entry-date""}, {""field"": ""start-date""}, {""field"": ""end-date""}], ""name"": ""Infrastructure project log""}, {""dataset"": ""infrastructure-project-document"", ""fields"": [{""field"": ""reference""}, {""description"": ""the ID of the infrastructure project"", ""field"": ""infrastructure-project""}, {""dataset"": ""infrastructure-project-document-type"", ""description"": ""the type of document, for example development-consent-order"", ""field"": ""document-type""}, {""description"": ""a name for the document"", ""field"": ""name""}, {""description"": ""any additional notes in this field"", ""field"": ""notes""}, {""description"": ""the organisation id of the organisation that provided this data"", ""field"": ""organisation""}, {""description"": ""a url to the document"", ""field"": ""document-url""}, {""description"": ""a url to the webpage where the document has been published"", ""field"": ""documentation-url""}, {""field"": ""entry-date""}, {""field"": ""start-date""}, {""field"": ""end-date""}], ""name"": ""Infrastructure project document""}]",,infrastructure-project,prospective,working-draft,
,listed-building-outline,,,,,2025-06-24,44,,,Listed building outline,"[{""dataset"": ""listed-building-outline"", ""fields"": [{""description"": ""the <a href=\""#reference\"">reference</a> for the listed building"", ""field"": ""reference"", ""guidance"": ""A reference or ID for each listed building that is:\n\n- unique within your dataset\n- permanent - it doesn't change when the dataset is updated\nIf you don't use a reference already, you will need to create one. It can be the Historic England reference used in the [register of listed buildings](https://historicengland.org.uk/listing/the-list/), or a short set of letters or numbers.\n\nExample: `LB1`\n""}, {""description"": ""the name of the listed building"", ""field"": ""name"", ""guidance"": ""The name of the listed building, as listed in the [register of listed buildings](https://historicengland.org.uk/listing/the-list/).\n\nExample: `10 and 12, Lower Clapton Road E5`\n""}, {""description"": ""the Historic England identifier for the listed building, for example <a href=\""https://historicengland.org.uk/listing/the-list/list-entry/1024710\"" class=\""govuk-link\"">1024710</a>"", ""field"": ""listed-building"", ""guidance"": ""The Historic England listed building reference for the listed building. This is recorded in the [register of listed buildings](https://historicengland.org.uk/listing/the-list/) as \""List Entry Number\"".\n\nExample: `1480524`\n""}, {""description"": ""the boundary of the area related to the listed building. Use curtilage (according to the <a href=\""https://historicengland.org.uk/images-books/publications/listed-buildings-and-curtilage-advice-note-10/heag125-listed-buildings-and-curtilage/\"" class=\""govuk-link\"">Historic England advice note</a>) if it\u2019s available."", ""field"": ""geometry"", ""guidance"": ""The outline of the listed building as a single polygon or multipolygon value. All points in the polygon must be in the WGS84 coordinate reference system.\n\nIf you\u2019re providing geometry in a CSV, geometry should be in well-known text (WKT).\n\nExample: `MULTIPOLYGON (((1.188829 51.23478,1.188376 51.234909,1.188381 51.234917,1.187912 51.235022...`\n\nIf you\u2019re providing geometry in a GeoJSON, GML or Geopackage, use the associated geometry format.\n""}, {""description"": ""a description of the area impacted by the listing"", ""field"": ""description""}, {""description"": ""optional notes"", ""field"": ""notes"", ""guidance"": ""Optional text on how this data was made or produced, or how it can be interpreted.\n""}, {""description"": ""the organisation responsible for the listed building"", ""field"": ""organisation""}, {""description"": ""a list of uprns contained in the area and therefore affected by the listing"", ""field"": ""uprns""}, {""description"": ""the date this information has been entered as a record"", ""field"": ""entry-date"", ""guidance"": ""The date the entity was last updated.\n\nIf the entity has never been updated, enter the same date as start-date.\n\nWrite in `YYYY-MM-DD` format.\n\nExample: `2022-12-20`\n""}, {""description"": ""the date the validity of the record starts"", ""field"": ""start-date"", ""guidance"": ""The date from which the building was listed, written in `YYYY-MM-DD` format.\n\nExample: `1984-03-28`\n""}, {""description"": ""the date the validity of the record ends"", ""field"": ""end-date"", ""guidance"": ""Where the building is no longer listed, this should be the date that it was [no longer in effect](https://standards.planning-data.dev/principles/#we-shouldn%E2%80%99t-delete-entries-in-a-register), written in YYYY-MM-DD format. If it's still listed, leave the cell blank.\n\nExample: `1999-01-20`\n""}]}]",,listed-building,digital-planning-funding,piloting,
,local-area-requirements,local-area-requirements,,,,2024-08-01,52,,,Local area requirement,"[{""dataset"": ""local-area-requirements"", ""fields"": [{""description"": ""a reference for the local area requirement document"", ""field"": ""reference""}, {""description"": ""a name used for this local area requirements document"", ""field"": ""name""}, {""description"": ""a description of the local area requirements document"", ""field"": ""description""}, {""description"": ""the organisation responsible for the local area requirements"", ""field"": ""organisation""}, {""description"": ""a list of urls to the documents that make up the local area requirements. Separate the urls with a `;`"", ""field"": ""document-urls""}, {""description"": ""a url to the page where the document(s) are published"", ""field"": ""documentation-url""}, {""description"": ""the date the local area requirements became active"", ""field"": ""period-start-date""}, {""description"": ""any additional notes about the local area requirements"", ""field"": ""notes""}, {""description"": ""the date this record was created"", ""field"": ""entry-date""}, {""description"": ""the date the validity of the record starts"", ""field"": ""start-date""}, {""description"": ""the date the validity of the record starts"", ""field"": ""end-date""}], ""name"": ""Local area requirements""}]",,local-area-requirement,prospective,working-draft,
,local-plan-timetable,local-plans,log of past and predicted milestones and events when producing a local plan,,,2025-11-05,97,,,local plan timetable,"[{""dataset"": ""local-plan-timetable"", ""fields"": [{""field"": ""reference"", ""requirement-level"": ""MUST""}, {""field"": ""local-plan"", ""requirement-level"": ""MUST""}, {""dataset"": ""local-plan-event"", ""field"": ""local-plan-event"", ""requirement-level"": ""MUST""}, {""field"": ""predicted-earliest-date"", ""requirement-level"": ""SHOULD""}, {""field"": ""predicted-latest-date"", ""requirement-level"": ""SHOULD""}, {""field"": ""entry-date"", ""requirement-level"": ""SHOULD""}, {""field"": ""start-date"", ""requirement-level"": ""SHOULD""}, {""field"": ""notes"", ""requirement-level"": ""MAY""}], ""priority"": 2, ""requirement-level"": ""SHOULD""}]",,local-plan-timetable,prospective,working-draft,
,local-planning-authority,development-corporation,,,,2025-11-05,,,,local planning authority,"[{""dataset"": ""local-planning-authority"", ""fields"": [{""field"": ""reference"", ""requirement-level"": ""MUST""}, {""field"": ""name"", ""requirement-level"": ""SHOULD""}, {""field"": ""documentation-url"", ""requirement-level"": ""SHOULD""}, {""field"": ""document-url"", ""requirement-level"": ""SHOULD""}, {""field"": ""geometry"", ""requirement-level"": ""SHOULD""}, {""field"": ""entry-date"", ""requirement-level"": ""SHOULD""}, {""field"": ""start-date"", ""requirement-level"": ""SHOULD""}, {""field"": ""end-date"", ""requirement-level"": ""MAY""}, {""field"": ""notes"", ""requirement-level"": ""MAY""}], ""priority"": 1, ""requirement-level"": ""SHOULD""}]",,local-planning-authority,prospective,working-draft,
,plan;plan-timetable,development-plans-and-timetables,"headline information about local plans, minerals and waste plans, and supplementary plans",,,2026-03-24,26,"local plan, minerals and waste plan, and supplementary plan","local plans, minerals and waste plans, and supplementary plans",plan,"[{""dataset"": ""plan"", ""fields"": [{""field"": ""reference"", ""requirement-level"": ""MUST""}, {""assertions"": [{""reference"": ""plan-A001"", ""requirement-level"": ""SHOULD"", ""text"": ""match the title of the document at `document-url`.""}], ""field"": ""name"", ""requirement-level"": ""MUST""}, {""field"": ""description"", ""requirement-level"": ""MUST""}, {""field"": ""datasets"", ""requirement-level"": ""MUST""}, {""field"": ""period-start-date"", ""requirement-level"": ""MUST""}, {""field"": ""period-end-date"", ""requirement-level"": ""MUST""}, {""datasets"": [""local-plan"", ""supplementary-plan""], ""field"": ""local-planning-authorities"", ""requirement-level"": ""CONDITIONAL""}, {""datasets"": [""waste-plan"", ""minerals-plan""], ""field"": ""minerals-and-waste-planning-authorities"", ""requirement-level"": ""CONDITIONAL""}, {""field"": ""documentation-url"", ""requirement-level"": ""MUST""}, {""assertions"": [{""reference"": ""plan-A002"", ""requirement-level"": ""MUST"", ""text"": ""link to the core plan document described by this data.""}], ""field"": ""document-url"", ""requirement-level"": ""MUST""}, {""datasets"": [""local-plan""], ""field"": ""required-housing"", ""requirement-level"": ""CONDITIONAL""}, {""datasets"": [""minerals-plan"", ""waste-plan""], ""field"": ""document-count"", ""requirement-level"": ""CONDITIONAL""}, {""field"": ""entry-date"", ""requirement-level"": ""MUST""}, {""field"": ""notes"", ""requirement-level"": ""MAY""}], ""priority"": 1, ""requirement-level"": ""MUST""}, {""dataset"": ""plan-timetable"", ""fields"": [{""field"": ""reference"", ""requirement-level"": ""MUST""}, {""field"": ""plan"", ""requirement-level"": ""MUST""}, {""dataset"": ""plan-event"", ""field"": ""plan-event"", ""requirement-level"": ""MUST""}, {""field"": ""event-date"", ""requirement-level"": ""MUST""}, {""field"": ""actual-date"", ""requirement-level"": ""CONDITIONAL""}, {""field"": ""entry-date"", ""requirement-level"": ""MUST""}, {""field"": ""notes"", ""requirement-level"": ""MAY""}], ""priority"": 2, ""requirement-level"": ""MUST""}]",,plan,local-plans-2025,working-draft,
